{
  "schema_version": 1,
  "case_id": "comment-agent/body-anchor",
  "scenario_id": "comment-agent",
  "example_id": "body-anchor",
  "title": "Keep a body comment anchored across selection changes",
  "seed": 1202,
  "fixture": "fixture.json",
  "expectations": "expectations.json",
  "actions": "actions.jsonl",
  "viewport": {
    "width": 1440,
    "height": 1000,
    "device_scale_factor": 1
  },
  "view_policy": {
    "selected_component_id": "welcome",
    "open_panel": "none",
    "focus": null,
    "scroll": {
      "app_x": 0,
      "app_y": 0,
      "canvas_x": 0,
      "canvas_y": 0
    }
  },
  "fault_profile": null,
  "tags": [
    "p0",
    "comment",
    "anchor"
  ]
}
