{
  "schema_version": 1,
  "case_id": "accessibility/narrow-large-text",
  "scenario_id": "accessibility",
  "example_id": "narrow-large-text",
  "title": "Use canvas on narrow viewport with large text",
  "seed": 2614,
  "fixture": "fixture.json",
  "expectations": "expectations.json",
  "actions": "actions.jsonl",
  "viewport": {
    "width": 390,
    "height": 844,
    "device_scale_factor": 1
  },
  "view_policy": {
    "selected_component_id": "card-a",
    "open_panel": "none",
    "focus": null,
    "scroll": {
      "app_x": 0,
      "app_y": 0,
      "canvas_x": 0,
      "canvas_y": 0
    }
  },
  "fault_profile": null,
  "tags": [
    "p1",
    "v2",
    "accessibility"
  ]
}
