{
  "schema_version": 1,
  "case_id": "human-edit/stale-conflict",
  "scenario_id": "human-edit",
  "example_id": "stale-conflict",
  "title": "Reject a stale draft without changing the model",
  "seed": 1103,
  "fixture": "fixture.json",
  "expectations": "expectations.json",
  "actions": "actions.jsonl",
  "viewport": {
    "width": 1440,
    "height": 1000,
    "device_scale_factor": 1
  },
  "view_policy": {
    "selected_component_id": "welcome",
    "open_panel": "none",
    "focus": null,
    "scroll": {
      "app_x": 0,
      "app_y": 0,
      "canvas_x": 0,
      "canvas_y": 0
    }
  },
  "fault_profile": null,
  "tags": [
    "p0",
    "conflict",
    "revision"
  ]
}
