{
  "schema_version": 1,
  "case_id": "audited-request/capture-off",
  "scenario_id": "audited-request",
  "example_id": "capture-off",
  "title": "Run an auditable request without full capture",
  "seed": 1601,
  "fixture": "fixture.json",
  "expectations": "expectations.json",
  "actions": "actions.jsonl",
  "viewport": {
    "width": 1440,
    "height": 1000,
    "device_scale_factor": 1
  },
  "view_policy": {
    "selected_component_id": "welcome",
    "open_panel": "none",
    "focus": null,
    "scroll": {
      "app_x": 0,
      "app_y": 0,
      "canvas_x": 0,
      "canvas_y": 0
    }
  },
  "fault_profile": null,
  "tags": [
    "p0",
    "request",
    "capture-off"
  ]
}
