{
  "schema_version": 1,
  "case_id": "export-restore/interrupted",
  "scenario_id": "export-restore",
  "example_id": "interrupted",
  "title": "Interrupted import preserves destination",
  "seed": 2609,
  "fixture": "fixture.json",
  "expectations": "expectations.json",
  "actions": "actions.jsonl",
  "viewport": {
    "width": 1440,
    "height": 1000,
    "device_scale_factor": 1
  },
  "view_policy": {
    "selected_component_id": "card-a",
    "open_panel": "none",
    "focus": null,
    "scroll": {
      "app_x": 0,
      "app_y": 0,
      "canvas_x": 0,
      "canvas_y": 0
    }
  },
  "fault_profile": null,
  "tags": [
    "p1",
    "v2",
    "export-restore"
  ]
}
