{
  "schema_version": 1,
  "case_id": "selection/multi",
  "scenario_id": "selection",
  "example_id": "multi",
  "title": "Prepare exact agent context for multi",
  "seed": 263094,
  "fixture": "fixture.json",
  "expectations": "expectations.json",
  "actions": "actions.jsonl",
  "viewport": {
    "width": 1440,
    "height": 1000,
    "device_scale_factor": 1
  },
  "view_policy": {
    "selected_component_id": "map-1",
    "open_panel": "none",
    "focus": null,
    "scroll": {
      "app_x": 0,
      "app_y": 0,
      "canvas_x": 0,
      "canvas_y": 0
    }
  },
  "fault_profile": null,
  "tags": [
    "p0",
    "v3",
    "mind-map",
    "selection",
    "agent-context",
    "exact-payload"
  ]
}
